key,value
Access Portal,EMR Utility Belt_Access Portal
Buy Now,EMR Utility Belt_Buy Now
Calculate,EMR Utility Belt_Calculate
Check Order Status,EMR Utility Belt_Check Order Status
Configure,EMR Utility Belt_Configure
Contact Local Partner,EMR Utility Belt_Contact Local Partner
Contact Sales,EMR Utility Belt_Contact Sales
Contact Service,EMR Utility Belt_Contact Service
Contact Support,EMR Utility Belt_Contact Support
Contact Us,EMR Utility Belt_Contact Us
Download Software,EMR Utility Belt_Download Software
Find a Store,EMR Utility Belt_Find a Store
Register Product,EMR Utility Belt_Register Product
Request Quote,EMR Utility Belt_Request Quote
Select,EMR Utility Belt_Select
Where to Buy,EMR Utility Belt_Where to Buy
Visit Our Blog,EMR Utility Belt_Visit our Blog
Chat Now,EMR Utility Belt_Click to Chat
Cross Reference and Product Information,EMR Utility Belt_Cross Reference and Product Information
MyEmerson,EMR Utility Belt_MyEmerson Sign In
Select Online,EMR Utility Belt_Select Online
Controls Navigator,EMR Utility Belt_Controls Navigator
Simple Instructions,EMR Utility Belt_Simple Instructions
